[
  {
    "id": "DUB-MON-0001",
    "name": "O'Connell Monument",
    "category": "MONUMENT",
    "district": "Dublin 1",
    "address": "O'Connell Street Lower, Dublin 1",
    "historical_period": "1866–1883",
    "historical_description": "Bronze monument to Daniel O'Connell, conceived by John Henry Foley in 1866 and completed by Thomas Brock in 1883. It includes a high-relief frieze and multiple figures around a granite plinth.",
    "historical_significance": "Major national monument at the southern entrance to O'Connell Street.",
    "national_inventory_reference": "50010320",
    "national_grid_reference": "315969, 234442",
    "latitude": 53.3477252,
    "longitude": -6.2593567,
    "verification_status": "VERIFIED",
    "photography_status": "TO_PHOTOGRAPH",
    "line_art_status": "TO_CREATE",
    "publication_status": "NOT_PUBLISHED",
    "parent_id": null,
    "access_status": "Public realm; check temporary event restrictions.",
    "map_url": "https://www.google.com/maps/dir/?api=1&destination=53.3477252%2C-6.2593567&travelmode=walking",
    "photography_brief": [
      "Full monument from front and sides",
      "O'Connell figure and bronze details",
      "High-relief frieze and individual figures",
      "Granite plinth and inscriptions"
    ],
    "sources": [
      "NIAH-50010320",
      "SRC-NIAH-NATIONAL-DATASET",
      "SRC-EPSG-TM65-29902"
    ],
    "coordinate_source": "Published NIAH Irish Grid reference converted from TM65 / Irish Grid (EPSG:29902) to WGS 84 using EPSG transformation operation 1641. The original point's positional accuracy is not specified; founder field verification remains outstanding.",
    "coordinate_accuracy_m": null,
    "coordinate_status": "SOURCE_DERIVED"
  },
  {
    "id": "DUB-BLD-0001",
    "name": "General Post Office (GPO)",
    "category": "ARCHITECTURE",
    "district": "Dublin 1",
    "address": "O'Connell Street Lower, Dublin 1",
    "historical_period": "1814–1818; rebuilt 1925–1932",
    "historical_description": "Neoclassical post office designed by Francis Johnston, with a six-column Ionic portico. Built 1814–1818, damaged during the 1916 Easter Rising and reconstructed in the 1920s. NIAH describes surviving physical traces including bullet marks.",
    "historical_significance": "Headquarters of the 1916 Easter Rising and major civic landmark.",
    "national_inventory_reference": "50010528",
    "national_grid_reference": "315881, 234624",
    "latitude": 53.349379,
    "longitude": -6.2606109,
    "verification_status": "VERIFIED",
    "photography_status": "TO_PHOTOGRAPH",
    "line_art_status": "TO_CREATE",
    "publication_status": "NOT_PUBLISHED",
    "parent_id": null,
    "access_status": "Public exterior; interior access subject to operating hours and venue rules.",
    "map_url": "https://www.google.com/maps/dir/?api=1&destination=53.3493790%2C-6.2606109&travelmode=walking",
    "photography_brief": [
      "Full façade from across O'Connell Street",
      "Six Ionic columns and portico ceiling",
      "Pediment, sculpture and clock",
      "Visible bullet marks and repairs",
      "Commemorative panels and inscriptions"
    ],
    "sources": [
      "NIAH-50010528",
      "NIAH-GPO-HISTORY",
      "SRC-NIAH-NATIONAL-DATASET",
      "SRC-EPSG-TM65-29902"
    ],
    "coordinate_source": "Published NIAH Irish Grid reference converted from TM65 / Irish Grid (EPSG:29902) to WGS 84 using EPSG transformation operation 1641. The original point's positional accuracy is not specified; founder field verification remains outstanding.",
    "coordinate_accuracy_m": null,
    "coordinate_status": "SOURCE_DERIVED"
  },
  {
    "id": "DUB-STR-0001",
    "name": "GPO historic cast-iron lantern bases and wheel guards",
    "category": "STREET_DETAIL",
    "district": "Dublin 1",
    "address": "In front of the General Post Office, O'Connell Street Lower, Dublin 1",
    "historical_period": "Circa 1820",
    "historical_description": "Pair of cast-iron lantern-post bases and six domed wheel-guards recorded by NIAH. Lantern bases are described as likely early nineteenth-century; wheel-guard date is less certain.",
    "historical_significance": "Rare surviving early nineteenth-century street furniture associated with the GPO.",
    "national_inventory_reference": "50010527",
    "national_grid_reference": "315899, 234629",
    "latitude": 53.3494199,
    "longitude": -6.2603389,
    "verification_status": "VERIFIED",
    "photography_status": "TO_PHOTOGRAPH",
    "line_art_status": "TO_CREATE",
    "publication_status": "NOT_PUBLISHED",
    "parent_id": "DUB-BLD-0001",
    "access_status": "Public realm; avoid obstructing pedestrians.",
    "map_url": "https://www.google.com/maps/dir/?api=1&destination=53.3494199%2C-6.2603389&travelmode=walking",
    "photography_brief": [
      "Both lantern bases in full",
      "Fluted panels, moulding and finials",
      "Each accessible wheel guard",
      "Relationship to GPO portico"
    ],
    "sources": [
      "NIAH-50010527",
      "SRC-NIAH-NATIONAL-DATASET",
      "SRC-EPSG-TM65-29902"
    ],
    "coordinate_source": "Published NIAH Irish Grid reference converted from TM65 / Irish Grid (EPSG:29902) to WGS 84 using EPSG transformation operation 1641. The original point's positional accuracy is not specified; founder field verification remains outstanding.",
    "coordinate_accuracy_m": null,
    "coordinate_status": "SOURCE_DERIVED"
  },
  {
    "id": "DUB-MEM-0001",
    "name": "Famine Memorial — Rowan Gillespie",
    "category": "MEMORIAL",
    "district": "Dublin 1",
    "address": "Custom House Quay, Dublin 1",
    "historical_period": "1997",
    "historical_description": "Six bronze figures by Rowan Gillespie, erected in 1997. The figures carry bundles and face east along Custom House Quay. Bronze commemorative plaques are set among granite paving stones around the group.",
    "historical_significance": "Public memorial commemorating the Great Famine and the suffering and emigration associated with it.",
    "national_inventory_reference": "50010002",
    "national_grid_reference": "316587, 234492",
    "latitude": 53.3480385,
    "longitude": -6.2500632,
    "verification_status": "VERIFIED",
    "photography_status": "TO_PHOTOGRAPH",
    "line_art_status": "TO_CREATE",
    "publication_status": "NOT_PUBLISHED",
    "parent_id": null,
    "access_status": "Public quayside; check temporary works and riverfront conditions.",
    "map_url": "https://www.google.com/maps/dir/?api=1&destination=53.3480385%2C-6.2500632&travelmode=walking",
    "photography_brief": [
      "Entire group from both ends",
      "Each of the six figures",
      "Bundles, clothing, faces and dog figure",
      "Bronze plaques and granite setts"
    ],
    "sources": [
      "NIAH-50010002",
      "SRC-NIAH-NATIONAL-DATASET",
      "SRC-EPSG-TM65-29902"
    ],
    "coordinate_source": "Published NIAH Irish Grid reference converted from TM65 / Irish Grid (EPSG:29902) to WGS 84 using EPSG transformation operation 1641. The original point's positional accuracy is not specified; founder field verification remains outstanding.",
    "coordinate_accuracy_m": null,
    "coordinate_status": "SOURCE_DERIVED"
  },
  {
    "id": "DUB-INS-0001",
    "name": "Bronze name plaques within the Famine Memorial paving",
    "category": "INSCRIPTION",
    "district": "Dublin 1",
    "address": "Granite-sett surround of Famine Memorial, Custom House Quay, Dublin 1",
    "historical_period": "1997",
    "historical_description": "NIAH describes bronze commemorative plaques dispersed among granite setts around the sculpture. Individual plaques and inscriptions require on-site transcription and photographic verification.",
    "historical_significance": "Names form part of the memorial composition; individual wording must be transcribed from legible photographs.",
    "national_inventory_reference": "Associated with 50010002",
    "national_grid_reference": "316587, 234492",
    "latitude": 53.3480385,
    "longitude": -6.2500632,
    "verification_status": "PARTIALLY_VERIFIED",
    "photography_status": "TO_PHOTOGRAPH",
    "line_art_status": "TO_CREATE",
    "publication_status": "NOT_PUBLISHED",
    "parent_id": "DUB-MEM-0001",
    "access_status": "Public quayside; do not step onto restricted surfaces.",
    "map_url": "https://www.google.com/maps/dir/?api=1&destination=53.3480385%2C-6.2500632&travelmode=walking",
    "photography_brief": [
      "Photograph each plaque square-on",
      "Capture complete wording and punctuation",
      "Record plaque position relative to figures",
      "Verify transcription against photograph"
    ],
    "sources": [
      "NIAH-50010002",
      "SRC-NIAH-NATIONAL-DATASET",
      "SRC-EPSG-TM65-29902"
    ],
    "coordinate_source": "Published NIAH Irish Grid reference converted from TM65 / Irish Grid (EPSG:29902) to WGS 84 using EPSG transformation operation 1641. The original point's positional accuracy is not specified; founder field verification remains outstanding.",
    "coordinate_accuracy_m": null,
    "coordinate_status": "SOURCE_DERIVED"
  },
  {
    "id": "DUB-BLD-0002",
    "name": "The Custom House",
    "category": "ARCHITECTURE",
    "district": "Dublin 1",
    "address": "Custom House Quay, Beresford Place, Dublin 1",
    "historical_period": "Begun 1781; reconstructed 1926–1929",
    "historical_description": "Neoclassical custom house designed by James Gandon. Construction began in 1781. Gutted by fire in May 1921 during the War of Independence and restored in 1926–1929. NIAH attributes exterior carvings to Edward Smyth.",
    "historical_significance": "One of Dublin's major neoclassical civic buildings and a key War of Independence site.",
    "national_inventory_reference": "50010133",
    "national_grid_reference": "316377, 234558",
    "latitude": 53.3486774,
    "longitude": -6.2531908,
    "verification_status": "VERIFIED",
    "photography_status": "TO_PHOTOGRAPH",